"id","jurisdiction_id","full_name","level","short_name"
"C0200001","J0200","Court of Appeals for the Second Circuit","F","Second Circuit"
"C0200002","J0200","Court of Appeals for the Sixth Circuit","F","Sixth Circuit"
"C0200003","J0200","Court of Appeals for the Seventh Circuit","F","Seventh Circuit"
"C0200004","J0200","Court of Appeals for the Fourth Circuit","F","Fourth Circuit"
"C0200005","J0200","Court of Appeals for the Ninth Circuit","F","Ninth Circuit"
"C0200006","J0200","Court of Appeals for the Third Circuit","F","Third Circuit"
"C0200007","J0200","Court of Appeals for the Tenth Circuit","F","Tenth Circuit"
"C0200008","J0200","Court of Appeals for the Federal Circuit","F","Federal Circuit"
"C0200009","J0200","Court of Appeals for the D.C. Circuit","F","D.C. Circuit"
"C0200010","J0200","District Court, District of Columbia","FD","District of Columbia"
"C0200011","J0200","United States Court of Federal Claims","FS","Federal Claims"
"C0200012","J0200","United States Judicial Panel on Multidistrict Litigation","FS","Judicial Panel on Multidistrict Litigation"
"C0200013","J0200","District Court, M.D. Florida","FD","M.D. Florida"
"C0200014","J0200","United States District Court","FD","U.S. District Court"
"C0200015","J0200","Supreme Court of the United States","F","Supreme Court"
"C0200016","J0200","Court of Appeals for the Armed Forces","FS","Court of Appeals for the Armed Forces"
"C0200017","J0200","United States Air Force Court of Criminal Appeals","FS","Air Force Court of Criminal Appeals"
"C0200018","J0200","Army Court of Criminal Appeals","FS","Army Court of Criminal Appeals"
"C0200019","J0200","District Court, Northern Mariana Islands","FD","Northern Mariana Islands"
"C0200020","J0200","Court of Appeals for the Eleventh Circuit","F","Eleventh Circuit"
"C0200021","J0200","Court of Appeals for the First Circuit","F","First Circuit"
"C0200022","J0200","United States Customs Court","FS","U.S. Customs Court"
"C0200023","J0200","U.S. Circuit Court for the District of Southern New York","FA","U.S. Circuit Court for the District of Southern New York"
"C0200024","J0200","United States Circuit Court","F","U.S. Circuit Court"
"C0200025","J0200","United States Tax Court","FS","U.S. Tax Court"
"C0200026","J0200","United States Court of Appeals for Veterans Claims","FS","Veterans Claims"
"C0200027","J0200","District Court, Virgin Islands","FD","Virgin Islands"
"C0200028","J0200","United States Board of Tax Appeals","FS","Board of Tax Appeals"
"C0200029","J0200","Navy-Marine Corps Court of Criminal Appeals","FS","Navy-Marine Corps Court of Criminal Appeals"
"C0200030","J0200","U.S. Circuit Court for the District of District of Columbia","FA","U.S. Circuit Court for the District of District of Columbia"
"C0200031","J0200","Court of Appeals for the Eighth Circuit","F","Eighth Circuit"
"C0200032","J0200","U.S. Circuit Court for the District of Eastern Virginia","FA","U.S. Circuit Court for the District of Eastern Virginia"
"C0200033","J0200","Court of Appeals for the Fifth Circuit","F","Fifth Circuit"
"C0200034","J0200","Superior Court of Guam","TA","Superior Court of Guam"
"C0200035","J0200","United States Bankruptcy Court, District of Columbia","FB","District of Columbia"
"C0200036","J0200","United States Bankruptcy Appellate Panel for the Eighth Circuit","FBP","Eighth Circuit"
"C0200037","J0200","United States Court of Military Appeals","FS","United States Court of Military Appeals"
"C0200038","J0200","United States Court of Claims","FS","Court of Claims"
"C0200039","J0200","U.S. Army Court of Military Review","FS","U.S. Army Court of Military Review"
"C0200040","J0200","U.S. Navy-Marine Corps Court of Military Review","FS","U.S. Navy-Marine Corps Court of Military Review"
"C0200041","J0200","U S Air Force Court of Military Review","FS","U S Air Force Court of Military Review"
"C0200042","J0200","U S Coast Guard Court of Criminal Appeals","FS","U S Coast Guard Court of Criminal Appeals"
"C0200043","J0200","Municipal Court of The Virgin Islands","TT","Municipal Court of The Virgin Islands"
"C0200044","J0200","U.S. Circuit Court for the District of Western New York","FA","U.S. Circuit Court for the District of Western New York"
"C0200045","J0200","United States Circuit Court for the Northern District of Florida","F","United States Circuit Court for the Northern District of Florida"
"C0200046","J0200","Court of Customs and Patent Appeals","FS","Customs and Patent Appeals"
"C0200047","J0200","U.S. Circuit Court for the District of California","FA","U.S. Circuit Court for the District of California"
"C0200048","J0200","U.S. Circuit Court for the District of Northern Iowa","FA","U.S. Circuit Court for the District of Northern Iowa"
"C0200049","J0200","U.S. Circuit Court for the District of Southern California","FA","U.S. Circuit Court for the District of Southern California"
"C0200050","J0200","U.S. Circuit Court for the District of Delaware","FD","Circuit Court of Delaware"
"C0200051","J0200","U.S. Circuit Court for the Southern District of Iowa","FA","U.S. Circuit Court for the Southern District of Iowa"
"C0200052","J0200","United States Court of International Trade","FS","Court of International Trade"
"C0200053","J0200","United States Bankruptcy Appellate Panel for the Ninth Circuit","FBP","Ninth Circuit"
"C0200054","J0200","District Court, D. Guam","FD","D. Guam"
"C0200055","J0200","Merit Systems Protection Board","FS","Merit Systems Protection Board"
"C0200056","J0200","Armed Services Board of Contract Appeals","FS","Armed Services Board of Contract Appeals"
"C0200057","J0200","Bankruptcy Appellate Panel of the First Circuit","FBP","First Circuit"
"C0200058","J0200","Bankruptcy Appellate Panel of the Tenth Circuit","FBP","Tenth Circuit"
"C0200059","J0200","Board of Veterans' Appeals","FS","Board of Veterans' Appeals"
"C0200060","J0200","United States Attorneys General","FS","Attorneys General"
"C0200061","J0200","Court Of Appeals Of Indian Territory","FS","Court Of Appeals Of Indian Territory"
"C0200062","J0200","Board of Immigration Appeals","FS","Board of Immigration Appeals"
"C0200063","J0200","Department of Justice Office of Legal Counsel","FS","Office of Legal Counsel"
"C0200064","J0200","Supreme Court Of The Territory Of Dakota","S","Supreme Court of Dakota"
"C0200065","J0200","Emergency Court of Appeals","FS","Emergency Court of Appeals"
"C0200066","J0200","U S Coast Guard Court of Military Review","FS","U S Coast Guard Court of Military Review"
"C0200067","J0200","District Court, Canal Zone","FD","Canal Zone"
"C0200068","J0200","Special Court under the Regional Rail Reorganization Act","FS","Special Court under the Regional Rail Reorganization Act"
"C0203015","J0203","Highlands Justice Court","ST","Highlands Justice Court"
"C0200069","J0200","Temporary Emergency Court of Appeals","FS","Temporary Emergency Court of Appeals"
"C0200070","J0200","Bankruptcy Appellate Panel of the Sixth Circuit","FBP","Sixth Circuit"
"C0200071","J0200","United States Circuit Court for the Southern District of Florida","F","United States Circuit Court for the Southern District of Florida"
"C0200072","J0200","Judicial Council of The Eighth Circuit","FS","Judicial Council of The Eighth Circuit"
"C0200073","J0200","Bankruptcy Appellate Panel of the Second Circuit","FBP","Second Circuit"
"C0200074","J0200","Foreign Intelligence Surveillance Court","FS","Foreign Intelligence Surveillance Court"
"C0200075","J0200","United States Bankruptcy Court, D. Virgin Islands","FB","D. Virgin Islands"
"C0200076","J0200","United States Court of Military Commission Review","FS","Military Commission Review"
"C0200077","J0200","United States Surveyor","FS","United States Surveyor"
"C0200078","J0200","Salina Register and Receiver","SS","Salina Register and Receiver"
"C0200079","J0200","U.S. Circuit Court for the Eastern District of Illinois","FA","U.S. Circuit Court for the Eastern District of Illinois"
"C0200080","J0200","United States Judicial Conference Committee","C","U.S. Judicial Conference Committee"
"C0200081","J0200","Superior Court, S. D. Florida","FS","Superior Court, S. D. Florida"
"C0200082","J0200","Police Court of The Virgin Islands","TT","Police Court of The Virgin Islands"
"C0200083","J0200","Department of Interior","FS","Department of Interior"
"C0200084","J0200","United States Bankruptcy Court, D. Guam","FB","D. Guam"
"C0200085","J0200","Judicial Council of The Ninth Circuit","FS","Judicial Council of The Ninth Circuit"
"C0200086","J0200","Decisions of the Federal Communications Commission","C","Decisions of the Federal Communications Commission"
"C0200087","J0200","United States Judicial Conference Committee on Judicial Conduct and Disability","FS","United States Judicial Conference Committee on Judicial Conduct and Disability"
"C0200088","J0200","Judicial Council of The Fifth Circuit","FS","Judicial Council of The Fifth Circuit"
"C0200089","J0200","Judicial Council of The Second Circuit","FS","Judicial Council of The Second Circuit"
"C0200090","J0200","Foreign Intelligence Surveillance Court of Review","FS","Foreign Intelligence Surveillance Court of Review"
"C0200091","J0200","U.S. Circuit Court for the Mississippi Territory","FA","U.S. Circuit Court for the Mississippi Territory"
"C0200092","J0200","Judicial Council of The Seventh Circuit","FS","Judicial Council of The Seventh Circuit"
"C0200093","J0200","United States Land Office","FS","United States Land Office"
"C0201001","J0201","District Court, S.D. Alabama","FD","S.D. Alabama"
"C0201002","J0201","Supreme Court of Alabama","S","Supreme Court of Alabama"
"C0201003","J0201","Court of Criminal Appeals of Alabama","SA","Court of Criminal Appeals of Alabama"
"C0201004","J0201","Court of Civil Appeals of Alabama","SA","Court of Civil Appeals of Alabama"
"C0201005","J0201","United States Bankruptcy Court, N.D. Alabama","FB","N.D. Alabama"
"C0201006","J0201","District Court, N.D. Alabama","FD","N.D. Alabama"
"C0201007","J0201","District Court, M.D. Alabama","FD","M.D. Alabama"
"C0201008","J0201","U.S. Circuit Court for the District of Northern Alabama","FA","U.S. Circuit Court for the District of Northern Alabama"
"C0201009","J0201","U.S. Circuit Court for the District of Southern Alabama","FA","U.S. Circuit Court for the District of Southern Alabama"
"C0201010","J0201","Montgomery County Circuit Court","ST","Montgomery County Circuit Court"
"C0201011","J0201","Alabama Court of Appeals","SA","Alabama Court of Appeals"
"C0201012","J0201","Madison County Circuit Court","ST","Madison County Circuit Court"
"C0201013","J0201","United States Bankruptcy Court, M.D. Alabama","FB","M.D. Alabama"
"C0201014","J0201","United States Bankruptcy Court, S.D. Alabama","FB","S.D. Alabama"
"C0201015","J0201","Montgomery Circuit Court","ST","Montgomery Circuit Court"
"C0201016","J0201","Henry County Circuit Court","ST","Henry County Circuit Court"
"C0201017","J0201","Montgomery County Probate Court","ST","Montgomery County Probate Court"
"C0201018","J0201","Russell County Circuit Court","ST","Russell County Circuit Court"
"C0201019","J0201","Columbiana Circuit Court","ST","Columbiana Circuit Court"
"C0201020","J0201","U.S. Circuit Court for the District of Middle Alabama","FA","U.S. Circuit Court for the District of Middle Alabama"
"C0201021","J0201","District Court, D. Alabama","FD","D. Alabama"
"C0201022","J0201","Morgan County Probate Court","ST","Morgan County Probate Court"
"C0201023","J0201","U.S. Circuit Court for the District of Alabama","FA","U.S. Circuit Court for the District of Alabama"
"C0201024","J0201","Perry County Probate Court","ST","Perry County Probate Court"
"C0201025","J0201","Morgan Circuit Court","ST","Morgan Circuit Court"
"C0201026","J0201","Madison County Probate Court","ST","Madison County Probate Court"
"C0201027","J0201","Jacksonville Civil Service Board","SS","Jacksonville Civil Service Board"
"C0201028","J0201","Jefferson County Probate Court","ST","Jefferson County Probate Court"
"C0202001","J0202","Alaska Supreme Court","S","Alaska Supreme Court"
"C0202002","J0202","Court of Appeals of Alaska","SA","Court of Appeals of Alaska"
"C0202003","J0202","District Court, D. Alaska","FD","D. Alaska"
"C0202004","J0202","United States Bankruptcy Court, D. Alaska","FB","D. Alaska"
"C0203001","J0203","Navajo Nation Supreme Court","TRS","Navajo Nation Supreme Court"
"C0203002","J0203","District Court, D. Arizona","FD","D. Arizona"
"C0203003","J0203","Court of Appeals of Arizona","SA","Court of Appeals of Arizona"
"C0203004","J0203","United States Bankruptcy Court, D. Arizona","FB","D. Arizona"
"C0203005","J0203","Arizona Supreme Court","S","Arizona Supreme Court"
"C0203006","J0203","Hopi Appellate Court","TRA","Hopi Appellate Court"
"C0203007","J0203","Arcadia Justice Court","ST","Arcadia Justice Court"
"C0203008","J0203","Arizona Tax Court","SS","Arizona Tax Court"
"C0203009","J0203","Navajo Nation Court of Appeals","TRA","Navajo Nation Ct. App."
"C0203010","J0203","Fort McDowell Yavapai Nation Tribal Court of Appeals","TRA","Fort McDowell Yavapai Nation Tribal Court of Appeals"
"C0203011","J0203","Navajo Nation Family Court","TRX","Navajo Nation Family Court"
"C0203012","J0203","Fort McDowell Supreme Court","TRS","Fort McDowell Supreme Court"
"C0203013","J0203","Navajo Nation Children's Court","TRX","Navajo Nation Children's Court"
"C0203014","J0203","Monroe Justice Court","ST","Monroe Justice Court"
"C0204001","J0204","District Court, E.D. Arkansas","FD","E.D. Arkansas"
"C0204002","J0204","District Court, W.D. Arkansas","FD","W.D. Arkansas"
"C0204003","J0204","Supreme Court of Arkansas","S","Supreme Court of Arkansas"
"C0204004","J0204","Court of Appeals of Arkansas","SA","Court of Appeals of Arkansas"
"C0204005","J0204","United States District Court for the District of Arkansas","FD","United States District Court for the District of Arkansas"
"C0204006","J0204","U.S. Circuit Court for the District of Eastern Arkansas","FA","U.S. Circuit Court for the District of Eastern Arkansas"
"C0204007","J0204","U.S. Circuit Court for the District of Arkansas","FA","U.S. Circuit Court for the District of Arkansas"
"C0204008","J0204","U.S. Circuit Court for the District of Western Arkansas","FA","U.S. Circuit Court for the District of Western Arkansas"
"C0204009","J0204","United States Bankruptcy Court, W.D. Arkansas","FB","W.D. Arkansas"
"C0204010","J0204","United States Bankruptcy Court, E.D. Arkansas","FB","E.D. Arkansas"
"C0204011","J0204","Arkansas Attorney General Reports","SAG","Arkansas Attorney General Reports"
"C0204012","J0204","Pulaski County Circuit Court","ST","Pulaski County Circuit Court"
"C0204013","J0204","Carroll County Circuit Court","ST","Carroll County Circuit Court"
"C0205001","J0205","District Court, N.D. California","FD","N.D. California"
"C0205002","J0205","District Court, E.D. California","FD","E.D. California"
"C0205003","J0205","District Court, C.D. California","FD","C.D. California"
"C0205004","J0205","Appellate Division of the Superior Court of California","SA","Appellate Division of the Superior Court of California"
"C0205005","J0205","District Court, D. California","FD","D. California"
"C0205006","J0205","California Supreme Court","S","California Supreme Court"
"C0205007","J0205","United States Bankruptcy Court, C.D. California","FB","C.D. California"
"C0205008","J0205","California Court of Appeal, 5th District","SA","California Court of Appeal, 5th District"
"C0205009","J0205","District Court, S.D. California","FD","S.D. California"
"C0205010","J0205","U.S. Circuit Court for the District of Northern California","FA","U.S. Circuit Court for the District of Northern California"
"C0205011","J0205","California Court of Appeal","SA","California Court of Appeal"
"C0205012","J0205","United States Bankruptcy Court, S.D. California","FB","S.D. California"
"C0205013","J0205","California Attorney General Reports","SAG","California Attorney General Reports"
"C0205014","J0205","Orange County Court","ST","Orange County Court"
"C0205015","J0205","California Superior Court","ST","California Superior Court"
"C0205016","J0205","California District Court","ST","Cal. District Court"
"C0205017","J0205","United States Bankruptcy Court, E.D. California","FB","E.D. California"
"C0205018","J0205","United States Bankruptcy Court, N.D. California","FB","N.D. California"
"C0205019","J0205","California Court of Appeal, 4th District","SA","California Court of Appeal, 4th District"
"C0205020","J0205","Superior Court of California, County of San Francisco","ST","California Superior Court, San Francisco County"
"C0205021","J0205","California Court of Appeal, 2nd District","SA","California Court of Appeal, 2nd District"
"C0205022","J0205","State of California Commission On Judicial Performance","C","State of California Commission On Judicial Performance"
"C0205023","J0205","Yuba District Court","ST","Yuba District Court"
"C0205024","J0205","San Fransisco District Court","ST","San Fran. Dist Ct"
"C0205025","J0205","Sacramento District Court","ST","Sacramento District Court"
"C0205026","J0205","Orange County Judge's Court","ST","Orange County Judge's Court"
"C0205027","J0205","Monterey District Court","ST","Monterey District Court"
"C0205028","J0205","California Court of Appeal, 3rd District","SA","California Court of Appeal, 3rd District"
"C0205029","J0205","California Court of Appeal, 1st District","SA","California Court of Appeal, 1st District"
"C0205030","J0205","Yreka District Court","ST","Yreka District Court"
"C0205031","J0205","California Court of Appeal, 6th District","SA","California Court of Appeal, 6th District"
"C0205032","J0205","Trinity District Court","ST","Trinity District Court"
"C0205033","J0205","Shasta District Court","ST","Shasta District Court"
"C0205034","J0205","Placer District Court, California","ST","Placer District Court"
"C0205035","J0205","Santa Cruz District Court","ST","Santa Cruz District Court"
"C0205036","J0205","Fremont Municipal Court","ST","Fremont Municipal Court"
"C0206001","J0206","District Court, D. Colorado","FD","D. Colorado"
"C0206002","J0206","Supreme Court of Colorado","S","Supreme Court of Colorado"
"C0206003","J0206","Colorado Court of Appeals","SA","Colorado Court of Appeals"
"C0206004","J0206","United States Bankruptcy Court, D. Colorado","FB","D. Colorado"
"C0206005","J0206","Colorado Attorney General Reports","SAG","Colorado Attorney General Reports"
"C0206006","J0206","U.S. Circuit Court for the District of Colorado","FA","U.S. Circuit Court for the District of Colorado"
"C0206007","J0206","Pueblo County District Court","ST","Pueblo County District Court"
"C0206008","J0206","Lakewood Municipal Court","ST","Lakewood Municipal Court"
"C0206009","J0206","Arapahoe County District Court","ST","Arapahoe County District Court"
"C0206010","J0206","Bent County District Court","ST","Bent County District Court"
"C0206011","J0206","Denver Superior Court","ST","Denver Superior Court"
"C0206012","J0206","Garfield County District Court","ST","Garfield County District Court"
"C0206013","J0206","Teller County District Court","ST","Teller County District Court"
"C0206014","J0206","Larimer County District Court","ST","Larimer County District Court"
"C0206015","J0206","Pitkin County District Court","ST","Pitkin County District Court"
"C0207001","J0207","District Court, D. Connecticut","FD","D. Connecticut"
"C0207002","J0207","Connecticut Superior Court","SA","Connecticut Superior Court"
"C0207003","J0207","Supreme Court of Connecticut","S","Supreme Court of Connecticut"
"C0207004","J0207","Connecticut Appellate Court","SA","Connecticut Appellate Court"
"C0207005","J0207","United States Bankruptcy Court, D. Connecticut","FB","D. Connecticut"
"C0207006","J0207","U.S. Circuit Court for the District of Connecticut","FA","U.S. Circuit Court for the District of Connecticut"
"C0207007","J0207","Mohegan Gaming Disputes Trial Court","TRX","Mohegan Gaming Disputes Trial Court"
"C0207008","J0207","Mohegan Trial Court","TRT","Mohegan Trial Court"
"C0207009","J0207","Fairfield Circuit Court","ST","Fairfield Circuit Court"
"C0207010","J0207","Mohegan Gaming Disputes Court of Appeals","TRA","Mohegan Gaming Disputes Court of Appeals"
"C0207011","J0207","Fairfield County Probate Court","ST","Fairfield County Probate Court"
"C0207012","J0207","Mohegan Tribal Court of Appeals","TRA","Mohegan Tribal Court of Appeals"
"C0207013","J0207","Council of Elders of the Mohegan Tribe","TRX","Council of Elders of the Mohegan Tribe"
"C0208001","J0208","District Court, D. Delaware","FD","D. Delaware"
"C0208002","J0208","Supreme Court of Delaware","S","Supreme Court of Delaware"
"C0208003","J0208","Orphan's Court of Delaware","SA","Delaware Orphan's Court"
"C0208004","J0208","Court of Chancery of Delaware","SA","Court of Chancery of Delaware"
"C0208005","J0208","Delaware Court of Oyer and Terminer","ST","Delaware Court of Oyer and Terminer"
"C0208006","J0208","United States Bankruptcy Court, D. Delaware","FB","D. Delaware"
"C0208007","J0208","Delaware Circuit Court","ST","Delaware Circuit Court"
"C0208008","J0208","Superior Court of Delaware","SA","Superior Court of Delaware"
"C0208009","J0208","Court on the Judiciary of Delaware.","SS","Court on the Judiciary of Delaware"
"C0208010","J0208","Delaware Court of Common Pleas","SS","Delaware Court of Common Pleas"
"C0208011","J0208","Delaware Family Court","SS","Delaware Family Court"
"C0208012","J0208","Sussex County Superior Court","ST","Sussex County Superior Court"
"C0208013","J0208","Court of General Sessions of The Peace And Jail Delivery of Delaware","ST","Court of General Sessions of Delaware"
"C0209001","J0209","District Court, S.D. Florida","FD","S.D. Florida"
"C0209002","J0209","Supreme Court of Florida","S","Supreme Court of Florida"
"C0209003","J0209","District Court of Appeal of Florida","SA","District Court of Appeal of Florida"
"C0209004","J0209","United States Bankruptcy Court, S.D. Florida.","FB","S.D. Florida"
"C0209005","J0209","United States Bankruptcy Court, M.D. Florida","FB","M.D. Florida"
"C0209006","J0209","District Court, N.D. Florida","FD","N.D. Florida"
"C0209007","J0209","Florida Third District Court of Appeal","SA","Florida Third District Court of Appeal"
"C0209008","J0209","United States Bankruptcy Court, N.D. Florida","FB","N.D. Florida"
"C0209009","J0209","Florida Attorney General Reports","SAG","Florida Attorney General Reports"
"C0209010","J0209","Circuit Court of the 11th Judicial Circuit of Florida, Miami-Dade County","ST","Miami-Dade County Circuit Court"
"C0209011","J0209","Palm Beach County Judge's Court","ST","Palm Beach County Judge's Court"
"C0209012","J0209","Palm Beach County Juvenile and Domestic Relations Court","ST","Palm Beach County Juvenile and Domestic Relations Court"
"C0209013","J0209","Circuit Court for the Judicial Circuits of Florida","ST","Florida Circuit Courts"
"C0209014","J0209","Broward County Court","ST","Broward County Court"
"C0209015","J0209","Volusia County Court","ST","Volusia County Court"
"C0209016","J0209","Florida Public Service Commission","SS","Florida Public Service Commission"
"C0209017","J0209","State of Florida Division of Administrative Hearings","SS","State of Florida Division of Administrative Hearings"
"C0209018","J0209","District Court, D. Florida","FD","D. Florida"
"C0209019","J0209","Circuit Court of the 15th Judicial Circuit of Florida, Palm Beach County","ST","Palm Beach County Circuit Court"
"C0209020","J0209","Circuit Court of the 4th Judicial Circuit of Florida, Duval County","ST","Duval County Circuit Court"
"C0209021","J0209","Circuit Court of the 2nd Judicial Circuit of Florida, Leon County","ST","Leon County Circuit Court"
"C0209022","J0209","Circuit Court of the 9th Judicial Circuit of Florida, Orange County","ST","Orange County Circuit Court"
"C0209023","J0209","Circuit Court of the 14th Judicial Circuit of Florida, Bay County","ST","Bay County Circuit Court"
"C0209024","J0209","Florida First District Court of Appeal","SA","Florida First District Court of Appeal"
"C0209025","J0209","Circuit Court of the 13th Judicial Circuit of Florida, Hillsborough County","ST","Hillsborough County Circuit Court"
"C0209026","J0209","Circuit Court of the 4th Judicial Circuit of Florida, Nassau County","ST","Nassau County Circuit Court"
"C0209027","J0209","Florida Second District Court of Appeal","SA","Florida Second District Court of Appeal"
"C0209028","J0209","Florida Fifth District Court of Appeal","SA","Florida Fifth District Court of Appeal"
"C0209029","J0209","Dade County Judge's Court","ST","Dade County Judge's Court"
"C0209030","J0209","Circuit Court of the 18th Judicial Circuit of Florida, Brevard County","ST","Brevard County Circuit Court"
"C0209031","J0209","Circuit Court of the 6th Judicial Circuit of Florida, Pasco County","ST","Pasco County Circuit Court"
"C0209032","J0209","Palm Beach County Court","ST","Palm Beach County Court"
"C0209033","J0209","Florida Industrial Commission","SS","Florida Industrial Commission"
"C0209034","J0209","Circuit Court of the 19th Judicial Circuit of Florida, Indian River County","ST","Indian River County Circuit Court"
"C0209035","J0209","Brevard County Civil and Criminal Court of Record","ST","Brevard County Court of Record"
"C0209036","J0209","Circuit Court of the 16th Judicial Circuit of Florida, Monroe County","ST","Monroe County Circuit Court"
"C0209037","J0209","Hillsborough County Court","ST","Hillsborough County Court"
"C0209038","J0209","Florida Real Estate Commission","SS","Florida Real Estate Commission"
"C0209039","J0209","Dade County Small Claims Court","ST","Dade County Small Claims Court"
"C0209040","J0209","Pinellas County Court","ST","Pinellas County Court"
